{
  "status": "pass",
  "errors": [],
  "warnings": [],
  "field_checks": {
    "anomaly_ids_present": true,
    "record_ids_present": true,
    "answer_present": true,
    "citations_present": true,
    "answer_non_empty": true
  },
  "id_checks": {
    "anomaly_ids_valid": true,
    "record_ids_valid": true,
    "record_ids_match_candidate": true,
    "no_orphan_records": true
  },
  "evidence_checks": {
    "evidence_matrix_valid": true,
    "no_anomaly_coverage_complete": true,
    "coverage_percent_100": true
  },
  "answer_consistency_checks": {
    "no_anomaly_matches_empty_ids": true,
    "answer_matches_no_anomaly": true
  },
  "repair_count": 0,
  "repairable_fields": [],
  "submission_allowed": true
}
