{
  "status": "pass",
  "errors": [],
  "warnings": [],
  "field_checks": {
    "anomaly_ids_type": "pass",
    "record_ids_type": "pass",
    "answer_type": "pass",
    "citations_type": "pass",
    "no_extra_fields": "pass",
    "all_required_present": "pass"
  },
  "id_checks": {
    "record_ids_in_db": "pass",
    "doc_ids_in_corpus": "pass",
    "anomaly_ids_consistent": "pass"
  },
  "evidence_checks": {
    "evidence_status": "pass",
    "coverage_percent": 100.0,
    "submitted_match_evidence": "pass",
    "anomaly_record_consistency": "pass"
  },
  "answer_consistency_checks": {
    "contains_wuyichang": true,
    "threshold_stated": true,
    "observed_value_stated": true,
    "record_ids_match_conclusion": true
  },
  "repair_count": 0,
  "repairable_fields": [],
  "submission_allowed": true
}
