{
  "status": "pass",
  "errors": [],
  "warnings": [],
  "field_checks": {
    "evidence_matrix_has_status": true,
    "evidence_matrix_has_coverage_percent": true,
    "evidence_matrix_has_evidence_rows": true,
    "evidence_matrix_has_candidate_record_ids": true,
    "evidence_matrix_has_submitted_record_ids": true,
    "evidence_matrix_has_unowned_record_ids": true,
    "evidence_matrix_has_unused_candidate_record_ids": true,
    "evidence_matrix_has_unused_citations": true,
    "evidence_matrix_has_missing_evidence": true,
    "evidence_matrix_has_no_anomaly_coverage": true,
    "evidence_matrix_has_reconciled_figures": true,
    "evidence_matrix_has_unresolved_items": true,
    "final_result_has_record_ids": true,
    "final_result_has_answer": true,
    "final_result_has_citations": true,
    "final_result_has_anomaly_ids": true
  },
  "id_checks": {
    "record_ids_consistent": true,
    "anomaly_ids_referenced_records_exist": true,
    "candidate_record_ids_all_investigated": true,
    "submitted_record_ids_all_in_evidence": true
  },
  "evidence_checks": {
    "all_evidence_rows_have_anomaly_id": true,
    "all_evidence_rows_have_record_ids": true,
    "all_evidence_rows_have_citations": true,
    "all_evidence_rows_have_facts_non_empty": true,
    "all_evidence_rows_fact_supported_true": true,
    "all_evidence_rows_rule_supported_true": true,
    "all_evidence_rows_coverage_status_pass": true
  },
  "answer_consistency_checks": {
    "anomaly_ids_in_answer_match_evidence": true,
    "record_ids_in_answer_match_evidence": true,
    "citations_in_answer_covered_by_evidence": true
  },
  "repair_count": 0,
  "repairable_fields": [],
  "submission_allowed": true
}
