{
  "status": "pass",
  "errors": [],
  "warnings": [],
  "field_checks": {
    "anomaly_ids_valid": true,
    "record_ids_valid": true,
    "answer_valid": true,
    "citations_valid": true
  },
  "id_checks": {
    "anomaly_ids_match_findings": true,
    "record_ids_match_evidence": true
  },
  "evidence_checks": {
    "facts_verified": true,
    "rules_supported": true
  },
  "answer_consistency_checks": {
    "anomaly_vs_answer_consistent": true,
    "records_vs_answer_consistent": true
  },
  "repair_count": 0,
  "repairable_fields": [],
  "submission_allowed": true
}