{
  "status": "pass",
  "errors": [],
  "warnings": [],
  "field_checks": {
    "anomaly_ids": {"present": true, "non_empty": true, "unique": true},
    "record_ids": {"present": true, "non_empty": true, "unique": true, "pattern_match": true},
    "answer": {"present": true, "non_empty": true},
    "citations": {"present": true, "non_empty": true, "unique": true}
  },
  "id_checks": {
    "record_ids_in_db": {"R004223": true},
    "doc_ids_in_corpus": {"05_training_expense.md": true, "01_expense_reimbursement_2025.md": true}
  },
  "evidence_checks": {
    "evidence_status": "pass",
    "coverage_percent": 100,
    "submitted_match_evidence": true,
    "all_records_have_evidence": true,
    "all_anomalies_have_evidence": true
  },
  "answer_consistency_checks": {
    "anomaly_count_matches_evidence": true,
    "record_count_matches_evidence": true,
    "answer_mentions_no_anomaly": false,
    "positive_result_has_anomalies": true
  },
  "repair_count": 0,
  "repairable_fields": [],
  "submission_allowed": true
}
